{
  "color": {
    "primary": {
      "$root": {
        "$type": "color",
        "$value": {
          "colorSpace": "srgb",
          "components": [
            0.1725,
            0.3647,
            0.3647
          ]
        }
      },
      "inverted": {
        "$type": "color",
        "$value": {
          "colorSpace": "srgb",
          "components": [
            1.0,
            1.0,
            1.0
          ]
        }
      }
    },
    "onPrimary": {
      "$root": {
        "$type": "color",
        "$value": {
          "colorSpace": "srgb",
          "components": [
            1.0,
            1.0,
            1.0
          ]
        }
      },
      "inverted": {
        "$type": "color",
        "$value": {
          "colorSpace": "srgb",
          "components": [
            0.1294,
            0.1373,
            0.1529
          ]
        }
      }
    },
    "bg": {
      "$root": {
        "$type": "color",
        "$value": {
          "colorSpace": "srgb",
          "components": [
            1.0,
            1.0,
            1.0
          ]
        }
      },
      "inverted": {
        "$type": "color",
        "$value": {
          "colorSpace": "srgb",
          "components": [
            0.1294,
            0.1373,
            0.1529
          ]
        }
      }
    },
    "fg": {
      "$root": {
        "$type": "color",
        "$value": {
          "colorSpace": "srgb",
          "components": [
            0.1294,
            0.1373,
            0.1529
          ]
        }
      },
      "inverted": {
        "$type": "color",
        "$value": {
          "colorSpace": "srgb",
          "components": [
            1.0,
            1.0,
            1.0
          ]
        }
      }
    },
    "link": {
      "$root": {
        "$type": "color",
        "$value": {
          "colorSpace": "srgb",
          "components": [
            0.1725,
            0.3647,
            0.3647
          ]
        }
      },
      "inverted": {
        "$type": "color",
        "$value": {
          "colorSpace": "srgb",
          "components": [
            1.0,
            1.0,
            1.0
          ]
        }
      }
    },
    "positive": {
      "$root": {
        "$type": "color",
        "$value": {
          "colorSpace": "srgb",
          "components": [
            0.4314,
            0.8588,
            0.3922
          ]
        }
      },
      "inverted": {
        "$type": "color",
        "$value": {
          "colorSpace": "srgb",
          "components": [
            0.1373,
            0.5137,
            0.1059
          ]
        }
      }
    },
    "negative": {
      "$root": {
        "$type": "color",
        "$value": {
          "colorSpace": "srgb",
          "components": [
            1.0,
            0.102,
            0.3412
          ]
        }
      },
      "inverted": {
        "$type": "color",
        "$value": {
          "colorSpace": "srgb",
          "components": [
            0.8235,
            0.1137,
            0.2824
          ]
        }
      }
    },
    "informative": {
      "$root": {
        "$type": "color",
        "$value": {
          "colorSpace": "srgb",
          "components": [
            0.3922,
            0.7608,
            0.8588
          ]
        }
      },
      "inverted": {
        "$type": "color",
        "$value": {
          "colorSpace": "srgb",
          "components": [
            0.0,
            0.4431,
            0.5608
          ]
        }
      }
    },
    "notice": {
      "$root": {
        "$type": "color",
        "$value": {
          "colorSpace": "srgb",
          "components": [
            0.9765,
            0.8706,
            0.3333
          ]
        }
      },
      "inverted": {
        "$type": "color",
        "$value": {
          "colorSpace": "srgb",
          "components": [
            1.0,
            0.3647,
            0.3255
          ]
        }
      }
    },
    "scale": {
      "1": {
        "$type": "number",
        "$value": 0.95
      },
      "2": {
        "$type": "number",
        "$value": 0.85
      },
      "3": {
        "$type": "number",
        "$value": 0.73
      },
      "4": {
        "$type": "number",
        "$value": 0.61
      },
      "5": {
        "$type": "number",
        "$value": 0.5
      },
      "6": {
        "$type": "number",
        "$value": 0.39
      },
      "7": {
        "$type": "number",
        "$value": 0.27
      },
      "8": {
        "$type": "number",
        "$value": 0.15
      },
      "9": {
        "$type": "number",
        "$value": 0.05
      }
    }
  },
  "font": {
    "family": {
      "display": {
        "$type": "fontFamily",
        "$value": [
          "Metropolis",
          "Baskerville",
          "Baskerville Old Face",
          "Hoefler Text",
          "Times New Roman",
          "serif"
        ]
      },
      "copy": {
        "$type": "fontFamily",
        "$value": [
          "system-ui",
          "Segoe UI",
          "Roboto",
          "Helvetica",
          "Arial",
          "sans-serif",
          "Apple Color Emoji",
          "Segoe UI Emoji",
          "Segoe UI Symbol"
        ]
      },
      "interface": {
        "$type": "fontFamily",
        "$value": [
          "system-ui",
          "Segoe UI",
          "Roboto",
          "Helvetica",
          "Arial",
          "sans-serif",
          "Apple Color Emoji",
          "Segoe UI Emoji",
          "Segoe UI Symbol"
        ]
      },
      "mono": {
        "$type": "fontFamily",
        "$value": [
          "ui-monospace",
          "SFMono-Regular",
          "SF Mono",
          "Menlo",
          "Consolas",
          "Liberation Mono",
          "monospace"
        ]
      }
    },
    "weight": {
      "light": {
        "$type": "fontWeight",
        "$value": 300
      },
      "regular": {
        "$type": "fontWeight",
        "$value": 400
      },
      "medium": {
        "$type": "fontWeight",
        "$value": 500
      },
      "semi-bold": {
        "$type": "fontWeight",
        "$value": 600
      },
      "bold": {
        "$type": "fontWeight",
        "$value": 700
      }
    },
    "size": {
      "display": {
        "base": {
          "$type": "dimension",
          "$value": {
            "value": 20,
            "unit": "px"
          }
        },
        "shrink-factor": {
          "$type": "number",
          "$value": 1.5
        },
        "grow-factor": {
          "$type": "number",
          "$value": 1.5
        },
        "bp-factor": {
          "$type": "number",
          "$value": 1.5
        }
      },
      "copy": {
        "base": {
          "$type": "dimension",
          "$value": {
            "value": 16,
            "unit": "px"
          }
        },
        "shrink-factor": {
          "$type": "number",
          "$value": 1.5
        },
        "grow-factor": {
          "$type": "number",
          "$value": 1.5
        },
        "bp-factor": {
          "$type": "number",
          "$value": 1.5
        }
      },
      "interface": {
        "base": {
          "$type": "dimension",
          "$value": {
            "value": 16,
            "unit": "px"
          }
        },
        "shrink-factor": {
          "$type": "number",
          "$value": 1.5
        },
        "grow-factor": {
          "$type": "number",
          "$value": 1.5
        },
        "bp-factor": {
          "$type": "number",
          "$value": 1.5
        }
      },
      "mono": {
        "base": {
          "$type": "dimension",
          "$value": {
            "value": 16,
            "unit": "px"
          }
        },
        "shrink-factor": {
          "$type": "number",
          "$value": 1.5
        },
        "grow-factor": {
          "$type": "number",
          "$value": 1.5
        },
        "bp-factor": {
          "$type": "number",
          "$value": 1.5
        }
      }
    }
  },
  "spacing": {
    "factor": {
      "$type": "number",
      "$value": 1.5
    },
    "shrink-factor": {
      "$type": "number",
      "$value": 1.5
    },
    "grow-factor": {
      "$type": "number",
      "$value": 1.5
    },
    "bp-factor": {
      "$type": "number",
      "$value": 1.5
    }
  },
  "border": {
    "width": {
      "default": {
        "$type": "dimension",
        "$value": {
          "value": 1,
          "unit": "px"
        }
      }
    },
    "radius-factor": {
      "$type": "number",
      "$value": 1.5
    }
  },
  "box-shadow": {
    "blur-factor": {
      "$type": "number",
      "$value": 1.5
    },
    "opacity-factor": {
      "$type": "number",
      "$value": 1.5
    },
    "spread-factor": {
      "$type": "number",
      "$value": 1.5
    }
  },
  "duration": {
    "factor": {
      "$type": "number",
      "$value": 1.5
    }
  }
}
